{
  "schema_version": "1.0",
  "run_id": "HAIR-003-B",
  "blind_condition_label": "Condition B",
  "panel_count": 6,
  "hair_observation": {
    "enabled": true,
    "active_axis_order": [
      "hair_length_extent",
      "neck_hair_overlap",
      "shoulder_hair_overlap",
      "hair_identity_clarity"
    ],
    "panels": [
      {
        "panel_id": 1,
        "hair_length_extent": "neck_to_shoulder",
        "neck_hair_overlap": "present",
        "shoulder_hair_overlap": "absent",
        "hair_identity_clarity": "distinct",
        "evidence_notes": [
          "Identifiable hair ends between the neck and shoulder line; its boundary is distinct from clothing and background."
        ],
        "confidence": "high"
      },
      {
        "panel_id": 2,
        "hair_length_extent": "neck_to_shoulder",
        "neck_hair_overlap": "present",
        "shoulder_hair_overlap": "absent",
        "hair_identity_clarity": "distinct",
        "evidence_notes": [
          "The visible hair overlaps the neck and ends above the shoulder line with a distinct boundary."
        ],
        "confidence": "high"
      },
      {
        "panel_id": 3,
        "hair_length_extent": "neck_to_shoulder",
        "neck_hair_overlap": "present",
        "shoulder_hair_overlap": "absent",
        "hair_identity_clarity": "distinct",
        "evidence_notes": [
          "The hair boundary is clearly visible at neck level and does not reach the shoulder line."
        ],
        "confidence": "high"
      },
      {
        "panel_id": 4,
        "hair_length_extent": "neck_to_shoulder",
        "neck_hair_overlap": "present",
        "shoulder_hair_overlap": "absent",
        "hair_identity_clarity": "distinct",
        "evidence_notes": [
          "The rear hair edge overlaps the neck and remains visibly above both shoulders."
        ],
        "confidence": "high"
      },
      {
        "panel_id": 5,
        "hair_length_extent": "neck_to_shoulder",
        "neck_hair_overlap": "present",
        "shoulder_hair_overlap": "absent",
        "hair_identity_clarity": "distinct",
        "evidence_notes": [
          "Identifiable hair covers part of the neck but has no visible shoulder overlap."
        ],
        "confidence": "high"
      },
      {
        "panel_id": 6,
        "hair_length_extent": "neck_to_shoulder",
        "neck_hair_overlap": "present",
        "shoulder_hair_overlap": "absent",
        "hair_identity_clarity": "distinct",
        "evidence_notes": [
          "The distinct hair edge lies around the neck and above the shoulder line."
        ],
        "confidence": "high"
      }
    ]
  },
  "computed_aggregate": {
    "axis_counts": {
      "hair_length_extent": {
        "above_neck": 0,
        "neck_to_shoulder": 6,
        "below_shoulder": 0,
        "waist_or_longer": 0,
        "unclear": 0,
        "not_visible": 0
      },
      "neck_hair_overlap": {
        "present": 6,
        "absent": 0,
        "unclear": 0,
        "not_visible": 0
      },
      "shoulder_hair_overlap": {
        "present": 0,
        "absent": 6,
        "unclear": 0,
        "not_visible": 0
      },
      "hair_identity_clarity": {
        "distinct": 6,
        "ambiguous_with_clothing": 0,
        "ambiguous_with_background": 0,
        "artifact": 0,
        "not_visible": 0
      }
    }
  }
}
