{
  "schema_version": "1.0",
  "run_id": "HAIR-001-A",
  "blind_condition_label": "Condition A",
  "panel_count": 6,
  "hair_observation": {
    "enabled": true,
    "active_axis_order": [
      "hair_length_extent",
      "neck_hair_overlap",
      "shoulder_hair_overlap",
      "hair_identity_clarity"
    ],
    "panels": [
      {
        "panel_id": 1,
        "hair_length_extent": "neck_to_shoulder",
        "neck_hair_overlap": "present",
        "shoulder_hair_overlap": "absent",
        "hair_identity_clarity": "distinct",
        "evidence_notes": [
          "Identifiable hair ends across the jaw and nape between the neck and shoulders; it overlaps the neck but remains visibly clear of both shoulders."
        ],
        "confidence": "high"
      },
      {
        "panel_id": 2,
        "hair_length_extent": "neck_to_shoulder",
        "neck_hair_overlap": "present",
        "shoulder_hair_overlap": "absent",
        "hair_identity_clarity": "distinct",
        "evidence_notes": [
          "The lower hair edge is clearly visible at the nape and jaw, below the upper neck but above both shoulders."
        ],
        "confidence": "high"
      },
      {
        "panel_id": 3,
        "hair_length_extent": "neck_to_shoulder",
        "neck_hair_overlap": "present",
        "shoulder_hair_overlap": "absent",
        "hair_identity_clarity": "distinct",
        "evidence_notes": [
          "The bob-shaped lower edge overlaps the nape and ends above the shoulder line with a distinct boundary from clothing."
        ],
        "confidence": "high"
      },
      {
        "panel_id": 4,
        "hair_length_extent": "neck_to_shoulder",
        "neck_hair_overlap": "present",
        "shoulder_hair_overlap": "absent",
        "hair_identity_clarity": "distinct",
        "evidence_notes": [
          "Identifiable hair covers the nape and ends before reaching either shoulder; its edge is visually distinct from the dark top."
        ],
        "confidence": "high"
      },
      {
        "panel_id": 5,
        "hair_length_extent": "neck_to_shoulder",
        "neck_hair_overlap": "present",
        "shoulder_hair_overlap": "absent",
        "hair_identity_clarity": "distinct",
        "evidence_notes": [
          "The visible lower hair boundary sits at the nape between neck and shoulder height and does not overlap a shoulder."
        ],
        "confidence": "high"
      },
      {
        "panel_id": 6,
        "hair_length_extent": "neck_to_shoulder",
        "neck_hair_overlap": "present",
        "shoulder_hair_overlap": "absent",
        "hair_identity_clarity": "distinct",
        "evidence_notes": [
          "The lower hair edge crosses the nape but remains above the shoulders, with clear separation from the sleeveless top."
        ],
        "confidence": "high"
      }
    ]
  },
  "computed_aggregate": {
    "axis_counts": {
      "hair_length_extent": {
        "above_neck": 0,
        "neck_to_shoulder": 6,
        "below_shoulder": 0,
        "waist_or_longer": 0,
        "unclear": 0,
        "not_visible": 0
      },
      "neck_hair_overlap": {
        "present": 6,
        "absent": 0,
        "unclear": 0,
        "not_visible": 0
      },
      "shoulder_hair_overlap": {
        "present": 0,
        "absent": 6,
        "unclear": 0,
        "not_visible": 0
      },
      "hair_identity_clarity": {
        "distinct": 6,
        "ambiguous_with_clothing": 0,
        "ambiguous_with_background": 0,
        "artifact": 0,
        "not_visible": 0
      }
    }
  }
}
