{
  "schema_version": "1.0",
  "run_id": "HAIR-001-B",
  "blind_condition_label": "Condition B",
  "panel_count": 6,
  "hair_observation": {
    "enabled": true,
    "active_axis_order": [
      "hair_length_extent",
      "neck_hair_overlap",
      "shoulder_hair_overlap",
      "hair_identity_clarity"
    ],
    "panels": [
      {
        "panel_id": 1,
        "hair_length_extent": "below_shoulder",
        "neck_hair_overlap": "present",
        "shoulder_hair_overlap": "present",
        "hair_identity_clarity": "distinct",
        "evidence_notes": [
          "Identifiable hair passes over the neck and shoulders and ends on the upper back below the shoulder line, well above the waist."
        ],
        "confidence": "high"
      },
      {
        "panel_id": 2,
        "hair_length_extent": "below_shoulder",
        "neck_hair_overlap": "present",
        "shoulder_hair_overlap": "present",
        "hair_identity_clarity": "distinct",
        "evidence_notes": [
          "Long strands visibly cross the neck and shoulder regions and extend onto the upper back below shoulder level."
        ],
        "confidence": "high"
      },
      {
        "panel_id": 3,
        "hair_length_extent": "below_shoulder",
        "neck_hair_overlap": "present",
        "shoulder_hair_overlap": "present",
        "hair_identity_clarity": "distinct",
        "evidence_notes": [
          "The lower hair boundary lies on the upper back below the shoulders, with distinct edges against the dark top."
        ],
        "confidence": "high"
      },
      {
        "panel_id": 4,
        "hair_length_extent": "below_shoulder",
        "neck_hair_overlap": "present",
        "shoulder_hair_overlap": "present",
        "hair_identity_clarity": "distinct",
        "evidence_notes": [
          "Hair visibly drapes across the neck and shoulder line and continues onto the upper back below the shoulders."
        ],
        "confidence": "high"
      },
      {
        "panel_id": 5,
        "hair_length_extent": "below_shoulder",
        "neck_hair_overlap": "present",
        "shoulder_hair_overlap": "present",
        "hair_identity_clarity": "distinct",
        "evidence_notes": [
          "The light-colored hair is clearly distinct from clothing and background, crossing both neck and shoulder regions and ending at mid-back above the waist."
        ],
        "confidence": "high"
      },
      {
        "panel_id": 6,
        "hair_length_extent": "below_shoulder",
        "neck_hair_overlap": "present",
        "shoulder_hair_overlap": "present",
        "hair_identity_clarity": "distinct",
        "evidence_notes": [
          "Identifiable hair crosses the neck and shoulders and reaches the upper back below shoulder level without reaching the waist."
        ],
        "confidence": "high"
      }
    ]
  },
  "computed_aggregate": {
    "axis_counts": {
      "hair_length_extent": {
        "above_neck": 0,
        "neck_to_shoulder": 0,
        "below_shoulder": 6,
        "waist_or_longer": 0,
        "unclear": 0,
        "not_visible": 0
      },
      "neck_hair_overlap": {
        "present": 6,
        "absent": 0,
        "unclear": 0,
        "not_visible": 0
      },
      "shoulder_hair_overlap": {
        "present": 6,
        "absent": 0,
        "unclear": 0,
        "not_visible": 0
      },
      "hair_identity_clarity": {
        "distinct": 6,
        "ambiguous_with_clothing": 0,
        "ambiguous_with_background": 0,
        "artifact": 0,
        "not_visible": 0
      }
    }
  }
}
